<AssetRegistries xmlns="http://arctisaurora/AuroraAssetRegistryTypes"
				 xmlns:xsi="http://www.w3.org/2001/XMLSchema-instance"
				 xsi:schemaLocation="http://arctisaurora/AuroraAssetRegistryTypes ../Schemas/AssetRegistryTypeSchema.xsd" >
	<Dictionary Name="IDMap" KeyType="xs:unsignedInt" ValueType="Type"/>
	<Dictionary Name="meshes" KeyType="xs:string" ValueType="AVulkanMesh"/>
	<Dictionary Name="fonts" KeyType="xs:string" ValueType="FontAsset"/>
	<Dictionary Name="iconSets" KeyType="xs:string" ValueType="IconSetAsset"/>
	<Dictionary Name="textures" KeyType="xs:string" ValueType="TextureAsset"/>
	<Dictionary Name="uiActions" KeyType="xs:string" ValueType="Action"/>
	<Dictionary Name="ActiveContexts" KeyType="xs:string" ValueType="Object"/>
	<Dictionary Name="Samplers" KeyType="xs:string" ValueType="SamplerAsset"/>
	<Dictionary Name="uiDocuments" KeyType="xs:string" ValueType="UIDocumentAsset"/>
	<Dictionary Name="contextMenus" KeyType="xs:string" ValueType="ContextMenuAsset"/>

</AssetRegistries>
